<!-- This is an example for the cadsrsentinel*.dtd. The values contained below are NOT guaranteed
        to be valid.
-->

<!-- Identify the content as the NCI caDSR data
-->

<!DOCTYPE cadsr SYSTEM "cadsrsentinel-1.0.dtd">

<cadsr>
    <!-- Identify the Alert Report output.
    -->
    <alertReport softwareName="NCI caDSR Sentinel Report Generator" softwareVersion="3.2.0.2">

        <!-- Describe the database used as the source of the data.
        -->
        <database name="NCI caDSR DEV" rai="2.16.840.1.113883.3.26.2" server="CBDEV"/>

        <!-- Describe the Alert Definition
        -->
        <definition>

            <!-- Basics
            -->
            <name value="alert definition name" />
            <id>database id</id>
            <intro>introduction text</intro>
            <createdBy user="account" name="person" email="email address"/>
            <recipient user="account" name="person1" email="email address" />
            <recipient user="account" name="person2" email="email address" />
            <summary>descriptive text</summary>
            <criteria type="CONTE" value="database id" />
            <criteria type="CSI">
                <value>xxxx</value>
                <value>xxxx</value>
                <value>xxxx</value>
            </criteria>
            <monitor type="WFS" id="database id" />
            <monitor type="REG" id="database id" />
            <monitor type="VERS" value="2"/>

            <!-- Describe the reporting scedule
            -->
            <lastAutoRun time="date & time"/>
            <frequency unit="daily, weekly, monthly" value="1"/>
            <status code="active, inactive, run once, run dates" beginDate="date" endDate="date"/>

            <!-- Describe the report
            -->
            <level depth="###"/>
            <start date="date"/>
            <end date="date"/>
            <createdOn time="date & time"/>
        </definition>

        <!-- Describe each (Administered) Item on the report.
        -->
        <changedItem
            type="DE, DEC, VD, OC, etc"
            name="name at time of report creation"
            id="database id"
            publicId="public id if exists"
            version="version if exists"
            modifiedByUser="account"
            modifiedByName="person"
            modifiedTime="date & time"
            createdByUser="account"
            createdByName="person"
            createdTime="date & time"
            changeNote="text">
            <details modifiedByUser="user" time="date & time">
                <change attribute="xxx" oldValue="xxx" newValue="xxx" />
                <change attribute="xxx"><oldValue>xxx</oldValue><newValue>xxx</newValue></change>
                <change attribute="xxx" oldValue="xxx" newValue="xxx" />
            </details>
            <details modifiedByUser="user" time="date & time">
                <change attribute="xxx"><oldValue>xxx</oldValue><newValue>xxx</newValue></change>
                <change attribute="xxx" oldValue="xxx" newValue="xxx" />
                <change attribute="xxx" oldValue="xxx" newValue="xxx" />
            </details>
        </changedItem>

        <!-- The following may not be needed for the first implementation?
        -->
        <associateItem
            type="DE, DEC, VD, OC, etc"
            name="name at time of report creation"
            id="database id"
            publicId="public id if exists"
            version="version if exists"
            modifiedByUser="user"
            modifiedTime="date & time"
            createdByUser="name"
            createdTime="date & time"
            changeNote="text"/>
        <associateItem
            type="DE, DEC, VD, OC, etc"
            name="name at time of report creation"
            id="database id"
            publicId="public id if exists"
            version="version if exists"
            modifiedByUser="user"
            modifiedTime="date & time"
            createdByUser="name"
            createdTime="date & time"
            changeNote="text"/>
        <associateItem
            type="DE, DEC, VD, OC, etc"
            name="name at time of report creation"
            id="database id"
            publicId="public id if exists"
            version="version if exists"
            modifiedByUser="user"
            modifiedTime="date & time"
            createdByUser="name"
            createdTime="date & time"
            changeNote="text"/>
        <associateItem
            type="DE, DEC, VD, OC, etc"
            name="name at time of report creation"
            id="database id"
            publicId="public id if exists"
            version="version if exists"
            modifiedByUser="user"
            modifiedTime="date & time"
            createdByUser="name"
            createdTime="date & time"
            changeNote="text"/>

        <!-- Describe each group as associations between the items.
        -->
        <group changedItemId="database id">
            <associate childItemId="database id" parentItemId="database id" />
            <associate childItemId="database id" parentItemId="database id" />
            <associate childItemId="database id" parentItemId="database id" />
            <associate childItemId="database id" parentItemId="database id" />
            <associate childItemId="database id" parentItemId="database id" />
        </group>
        <group changedItemId="database id">
            <associate childItemId="database id" parentItemId="database id" />
            <associate childItemId="database id" parentItemId="database id" />
            <associate childItemId="database id" parentItemId="database id" />
            <associate childItemId="database id" parentItemId="database id" />
            <associate childItemId="database id" parentItemId="database id" />
        </group>
        <group changedItemId="database id">
            <associate childItemId="database id" parentItemId="database id" />
            <associate childItemId="database id" parentItemId="database id" />
            <associate childItemId="database id" parentItemId="database id" />
            <associate childItemId="database id" parentItemId="database id" />
            <associate childItemId="database id" parentItemId="database id" />
        </group>
    </alertReport>
</cadsr>
